{
  "schema_version": "cuebook-hermes-skills-index-v1",
  "catalog_version": "1.31.0",
  "plugin_version": "0.9.22",
  "skills": [
    {
      "name": "query-cuebook",
      "description": "Read, compare, visualize, or explain Cuebook market intelligence without writes. Use for assets, Cues, Frames, market state, evidence, fundamentals, valuation, OHLCV, indicators, factual curves, settlement, community Skill discovery or provenance, commentator research, and explicit decision-memory reads. When separately connected and explicitly requested, add one bounded TradingView observation, focused capture, or network research check. Return a sourced CuebookQueryBundleV1. Do not draft or publish Frames, mutate charts or memories, install Skills, or call write tools. Frame and memory writes belong to create-cuebook-content; explicit submission of a creator-authored package with a root SKILL.md belongs only to author-cuebook-skill.",
      "files": [
        "SKILL.md",
        "agents/openai.yaml",
        "assets/plugin/cuebook-modules-v1.json",
        "assets/plugin/query-menu-v1.json",
        "assets/plugin/runtime-compatibility-v1.json",
        "evals/trigger_cases.json",
        "references/cuebook-intent-v1.schema.json",
        "references/cuebook-query-bundle-v1.schema.json",
        "references/cuebook-query-request-v1.schema.json",
        "references/decision-context-request-v2.schema.json",
        "references/decision-memory-coach.md",
        "references/modules/build-market-research-pack/MODULE.md",
        "references/modules/build-market-research-pack/evals/expected_artifacts.json",
        "references/modules/build-market-research-pack/evals/failure_cases.md",
        "references/modules/build-market-research-pack/evals/rubric.md",
        "references/modules/build-market-research-pack/evals/trigger_cases.json",
        "references/modules/build-market-research-pack/references/claim-enrichment-fast-path.md",
        "references/modules/build-market-research-pack/references/research-modules.md",
        "references/modules/build-market-research-pack/references/research-pack-v1.schema.json",
        "references/modules/build-market-research-pack/references/source-policy.md",
        "references/modules/build-market-research-pack/scripts/validate_json_schema.mjs",
        "references/modules/build-market-research-pack/scripts/validate_research_pack.mjs",
        "references/modules/build-market-research-pack/templates/brief-template.md",
        "references/modules/compute-cuebook-market-indicators/MODULE.md",
        "references/modules/compute-cuebook-market-indicators/references/indicator-pack-v1.schema.json",
        "references/modules/compute-cuebook-market-indicators/scripts/compute_indicators.mjs",
        "references/modules/reconcile-market-content-history/MODULE.md",
        "references/modules/reconcile-market-content-history/evals/expected_artifacts.json",
        "references/modules/reconcile-market-content-history/evals/failure_cases.md",
        "references/modules/reconcile-market-content-history/evals/rubric.md",
        "references/modules/reconcile-market-content-history/evals/trigger_cases.json",
        "references/modules/reconcile-market-content-history/references/content-history-ledger-v1.schema.json",
        "references/modules/reconcile-market-content-history/references/outcome-policy.md",
        "references/modules/reconcile-market-content-history/scripts/validate_content_history.mjs",
        "references/modules/reconcile-market-content-history/scripts/validate_json_schema.mjs",
        "references/modules/route-cuebook-narrative/MODULE.md",
        "references/modules/route-cuebook-narrative/references/narrative-taxonomy.md",
        "references/modules/route-cuebook-narrative/references/route-regression-cases.json",
        "references/modules/route-cuebook-narrative/references/route-v1.schema.json",
        "references/modules/route-cuebook-narrative/scripts/route_narrative.mjs",
        "references/modules/validate-cuebook-projection/MODULE.md",
        "references/modules/validate-cuebook-projection/references/db-regression-cases.json",
        "references/modules/validate-cuebook-projection/references/gate-v1.schema.json",
        "references/modules/validate-cuebook-projection/references/projection-rules.md",
        "references/modules/validate-cuebook-projection/scripts/validate_projection.mjs",
        "references/tradingview-focused-capture-v1.schema.json",
        "references/tradingview-focused-capture.md",
        "references/tradingview-observation-v1.schema.json",
        "references/tradingview-research-policy-v1.json",
        "references/tradingview-tool-policy-v1.json",
        "references/tradingview-workbench.md",
        "scripts/validate_cuebook_intent.mjs",
        "scripts/validate_decision_context_request.mjs",
        "scripts/validate_json_schema.mjs",
        "scripts/validate_query_bundle.mjs",
        "scripts/validate_query_request.mjs",
        "scripts/validate_tradingview_focused_capture.mjs",
        "scripts/validate_tradingview_observation.mjs"
      ],
      "content_sha256": "8fd239283a8a5fe47632145f2de1c49b296860cf3a5bd702db55024ef46e8426"
    },
    {
      "name": "create-cuebook-content",
      "description": "Create one creator-owned Frame from a market idea, selected Cuebook material, creator image, or public Artifact. Use for non-settling, directional, range, relative, or two-condition views; selected rights-cleared TradingView snapshots; confirmed chart canvas placement; or one explicit memory proposal. Frame and canvas stay separate. Never apply community SKILL.md package-submission rules to ordinary content, request an account name or handle, invent a path or proxy, trade, claim memory was saved, or publish without confirmation.",
      "files": [
        "SKILL.md",
        "agents/openai.yaml",
        "assets/plugin/cuebook-modules-v1.json",
        "assets/plugin/query-menu-v1.json",
        "assets/plugin/runtime-compatibility-v1.json",
        "evals/heuristic_interview_cases.json",
        "evals/pretrade-expression-rubric.json",
        "evals/trigger_cases.json",
        "references/creator-media-and-artifacts.md",
        "references/creator-seed-v1.schema.json",
        "references/cuebook-creation-bundle-v1.schema.json",
        "references/frame-art-direction.md",
        "references/frame-expression-system.md",
        "references/frame-feed-attention.md",
        "references/frame-lens-preview-job.schema.json",
        "references/frame-market-grammar-pairings.json",
        "references/frame-market-preview-job.schema.json",
        "references/frame-preview-v1.schema.json",
        "references/frame-publish-workflow.md",
        "references/frame-settlement-authoring.md",
        "references/frame.schema.json",
        "references/memory-proposal-discipline.md",
        "references/memory-proposal-v1.schema.json",
        "references/modules/build-market-research-pack/MODULE.md",
        "references/modules/build-market-research-pack/evals/expected_artifacts.json",
        "references/modules/build-market-research-pack/evals/failure_cases.md",
        "references/modules/build-market-research-pack/evals/rubric.md",
        "references/modules/build-market-research-pack/evals/trigger_cases.json",
        "references/modules/build-market-research-pack/references/claim-enrichment-fast-path.md",
        "references/modules/build-market-research-pack/references/research-modules.md",
        "references/modules/build-market-research-pack/references/research-pack-v1.schema.json",
        "references/modules/build-market-research-pack/references/source-policy.md",
        "references/modules/build-market-research-pack/scripts/validate_json_schema.mjs",
        "references/modules/build-market-research-pack/scripts/validate_research_pack.mjs",
        "references/modules/build-market-research-pack/templates/brief-template.md",
        "references/modules/compute-cuebook-market-indicators/MODULE.md",
        "references/modules/compute-cuebook-market-indicators/references/indicator-pack-v1.schema.json",
        "references/modules/compute-cuebook-market-indicators/scripts/compute_indicators.mjs",
        "references/modules/direct-cuebook-viewpoint-visual/assets/cuebook-wordmark.svg",
        "references/modules/direct-cuebook-viewpoint-visual/scripts/audit_finished_bitmap.mjs",
        "references/modules/direct-cuebook-viewpoint-visual/scripts/capture_html_viewpoint.cjs",
        "references/modules/direct-cuebook-viewpoint-visual/scripts/stamp_cuebook_wordmark.mjs",
        "references/modules/query-cuebook/MODULE.md",
        "references/modules/query-cuebook/evals/trigger_cases.json",
        "references/modules/query-cuebook/references/cuebook-intent-v1.schema.json",
        "references/modules/query-cuebook/references/cuebook-query-bundle-v1.schema.json",
        "references/modules/query-cuebook/references/cuebook-query-request-v1.schema.json",
        "references/modules/query-cuebook/references/decision-context-request-v2.schema.json",
        "references/modules/query-cuebook/references/decision-memory-coach.md",
        "references/modules/query-cuebook/references/tradingview-focused-capture-v1.schema.json",
        "references/modules/query-cuebook/references/tradingview-focused-capture.md",
        "references/modules/query-cuebook/references/tradingview-observation-v1.schema.json",
        "references/modules/query-cuebook/references/tradingview-research-policy-v1.json",
        "references/modules/query-cuebook/references/tradingview-tool-policy-v1.json",
        "references/modules/query-cuebook/references/tradingview-workbench.md",
        "references/modules/query-cuebook/scripts/validate_cuebook_intent.mjs",
        "references/modules/query-cuebook/scripts/validate_decision_context_request.mjs",
        "references/modules/query-cuebook/scripts/validate_json_schema.mjs",